{
  "ai_metadata": {
    "purpose": "",
    "last_updated": "",
    "template_version": "2.1",
    "ai_tool_compatibility": "",
    "ai_processing_level": "High",
    "required_context": "Project architecture, existing patterns, technical summaries",
    "validation_required": "Yes",
    "code_generation": "Supported",
    "cross_references": [
      "../project_context/Architecture%20Overview.json",
      "../project_context/Common%20Patterns.json",
      "../project_context/Development%20Workflow.json",
      "../summaries/stock_data_module_summary.json",
      "../guide_docs/Core%20Principles.json"
    ],
    "maintenance": ""
  },
  "file_info": {
    "file_path": "features/plans/[IN-PROGRESS]-Stock Tracking Request Plan.md",
    "original_format": "markdown",
    "converted_at": "2025-06-18T19:14:30.271324",
    "file_size": 19372,
    "line_count": 416,
    "optimized_at": "2025-06-18T19:19:47.733182",
    "optimization_version": "1.0"
  },
  "content": {
    "sections": [
      {
        "level": 1,
        "title": "Stock Tracking Request Plan",
        "content": "> This document outlines the plan for implementing stock tracking request functionality. Use this for understanding the planned implementation and requirements.",
        "subsections": []
      },
      {
        "level": 2,
        "title": "AI Metadata",
        "content": "**Template Version:** 2.1\n**AI Processing Level:** High\n**Required Context:** Project architecture, existing patterns, technical summaries\n**Validation Required:** Yes\n**Code Generation:** Supported\n\n**Dependencies:**\n- `../project_context/Architecture%20Overview.json.replace(\".json\", \".json\")` - System architecture\n- `../project_context/Common%20Patterns.json.replace(\".json\", \".json\")` - Project patterns\n- `../project_context/Development%20Workflow.json.replace(\".json\", \".json\")` - Development process\n- `../summaries/stock_data_module_summary.json.replace(\".json\", \".json\")` - Stock data module details\n- `../guide_docs/Core%20Principles.json.replace(\".json\", \".json\")` - Decision frameworks\n\n**Validation Rules:**\n- All placeholders must be replaced with specific content\n- File paths must reference actual codebase structure\n- Requirements must be measurable and testable\n- Implementation plan must reference existing patterns\n- Success criteria must be quantifiable",
        "subsections": []
      },
      {
        "level": 2,
        "title": "Overview",
        "content": "**Feature Name:** Stock Tracking Request UI\n**Status:** In Progress\n**Priority:** Medium\n**Target Release:** Sprint 3\n\n**AI Context:** This section establishes the feature identity and scope. Use consistent naming conventions from existing features.",
        "subsections": []
      },
      {
        "level": 2,
        "title": "Description",
        "content": "This feature will allow authenticated users to request that the system track specific stocks on their behalf. All backend logic will be contained within the `cream_api/stock_data` module, following the established project patterns.\n\n**AI Guidance**: Be specific about what the feature does, who uses it, and what problem it solves. Reference existing features for similar patterns.\n\nThis description should inform the implementation plan and user stories.",
        "subsections": []
      },
      {
        "level": 2,
        "title": "Business Value",
        "content": "- **User Engagement**: Increases user interaction with the platform by allowing them to request stock tracking\n- **Data Coverage**: Expands the range of stocks being tracked based on user demand\n- **User Satisfaction**: Provides users with control over which stocks are monitored\n- **Platform Growth**: Encourages users to return to check on their requested stocks\n\n**AI Guidance**: Connect to existing business goals. Reference similar features' impact if applicable.\n\nEach benefit should be measurable or observable.",
        "subsections": []
      },
      {
        "level": 2,
        "title": "User Stories",
        "content": "- As a **registered user**, I want to **request that a specific stock be tracked** so that **I can monitor stocks I'm interested in**\n- As a **registered user**, I want to **see confirmation when my request is processed** so that **I know the system is working on my request**\n- As an **admin user**, I want to **view all tracked stocks and their status** so that **I can manage the tracking system**\n- As an **admin user**, I want to **deactivate tracking for specific stocks** so that **I can control system resources**\n\n**AI Guidance**: Use existing user types from the system. Make stories specific and testable.\n\nThese stories will inform the user experience flow and acceptance criteria.\n\nEach story should be testable and have clear acceptance criteria.",
        "subsections": []
      },
      {
        "level": 2,
        "title": "Architecture Analysis",
        "content": "Based on the current project structure:\n- **Backend**: All stock-related logic in `cream_api/stock_data/` module\n- **Models**: Stock models in `cream_api/stock_data/models.py` (TrackedStock model)\n- **API**: Endpoints defined in `cream_api/stock_data/api.py`, router in `cream_api/main.py`\n- **Frontend**: React/TypeScript with shadcn/ui components in `cream_ui/src/`\n\n**AI Guidance**: Reference actual files and modules from the codebase. Use `../project_context/Architecture%20Overview.json.replace(\".json\", \".json\")` for context.\n\nThis analysis will determine which files need to be created or modified.\n\nAll listed files and modules must exist in the codebase.",
        "subsections": []
      },
      {
        "level": 2,
        "title": "Technical Requirements",
        "content": "",
        "subsections": []
      },
      {
        "level": 3,
        "title": "Functional Requirements",
        "content": "- **Stock Request Creation**: Users can submit stock symbol requests with validation\n- **Duplicate Prevention**: System prevents tracking the same stock multiple times\n- **Request Confirmation**: Users receive immediate feedback on request status\n- **Admin Management**: Admins can view and manage all tracked stocks\n- **Integration with Existing Pipeline**: New requests integrate with existing stock data processing\n\n**AI Guidance**: Make requirements specific enough that they can be implemented and tested. Reference existing patterns.\n\nThese requirements will become test cases and implementation tasks.\n\nEach requirement must have clear acceptance criteria.",
        "subsections": []
      },
      {
        "level": 3,
        "title": "Non-Functional Requirements",
        "content": "- **Performance**: API response time < 200ms for stock request submission\n- **Security**: Rate limiting of 10 requests/minute per user, input sanitization for stock symbols\n- **Scalability**: Support 100 concurrent stock request submissions\n- **Compatibility**: Works with existing authentication system and protected routes\n\n**AI Guidance**: Use measurable, specific requirements. Reference existing performance patterns.\n\nThese requirements will inform technical considerations and testing strategy.\n\nAll requirements must be measurable or verifiable.",
        "subsections": []
      },
      {
        "level": 2,
        "title": "Implementation Plan",
        "content": "",
        "subsections": []
      },
      {
        "level": 3,
        "title": "1. Database Schema Changes",
        "content": "",
        "subsections": []
      },
      {
        "level": 4,
        "title": "Update `cream_api/stock_data/models.py`",
        "content": "No new models needed - use existing `TrackedStock` model:\n\n- **TrackedStock Model**: Already exists and tracks stocks globally\n  - Fields: `id: int, symbol: str, last_pull_date: datetime, last_pull_status: str, error_message: str, is_active: bool`\n  - Unique constraint on symbol (prevents duplicate tracking)\n  - **Purpose**: Track which stocks are being monitored by the system\n  - **Relationships**: No new relationships needed\n\n**AI Guidance**: Reference existing models for field patterns. Use consistent naming conventions.\n\nThis will become the actual SQLAlchemy model definition.\n\nField types must match existing patterns, relationships must be valid.\n\nThe existing `TrackedStock` model is sufficient for our use case. When a user requests a stock:\n1. If the stock is already being tracked (exists in TrackedStock), the request is approved immediately\n2. If the stock is not being tracked, create a new TrackedStock entry and approve the request\n3. All users benefit from stocks being tracked, regardless of who requested them",
        "subsections": []
      },
      {
        "level": 3,
        "title": "2. Backend Implementation",
        "content": "",
        "subsections": []
      },
      {
        "level": 4,
        "title": "A. Models",
        "content": "- No changes needed to existing `TrackedStock` model\n- Use existing model with fields: `id`, `symbol`, `last_pull_date`, `last_pull_status`, `error_message`, `is_active`\n\nReference existing model patterns for consistency.",
        "subsections": []
      },
      {
        "level": 4,
        "title": "B. Schemas",
        "content": "- **StockRequestCreate**: `symbol: str = Field(..., min_length=1, max_length=10, regex=r'^[A-Z]+$')`\n- **StockRequestResponse**: Based on TrackedStock model with fields: `id`, `symbol`, `is_active`, `last_pull_date`\n- Include validation for symbol format (uppercase letters only) and length (1-10 characters)\n\nThis will become the actual Pydantic schema definition.",
        "subsections": []
      },
      {
        "level": 4,
        "title": "C. Business Logic",
        "content": "- `def process_stock_request(symbol: str, user_id: int) -> TrackedStock:` - Process user stock request\n- `def get_tracked_stocks() -> List[TrackedStock]:` - Get all tracked stocks (admin only)\n- `def deactivate_stock_tracking(symbol: str) -> TrackedStock:` - Deactivate tracking (admin only)\n- Reference existing patterns from `cream_api/stock_data/` module\n\nThese will become the actual function implementations.",
        "subsections": []
      },
      {
        "level": 4,
        "title": "D. Error Handling",
        "content": "- `StockAlreadyTrackedError` - When stock is already being tracked\n- `InvalidStockSymbolError` - When symbol format is invalid\n- `StockNotFoundError` - When stock doesn't exist in external API\n- Reference existing error patterns from `cream_api/common/exceptions.py`\n\nThese will become exception class definitions.",
        "subsections": []
      },
      {
        "level": 4,
        "title": "E. Background Tasks",
        "content": "- No additional tasks needed - use existing `update_all_tracked_stocks()` from `cream_api/stock_data/tasks.py`\n- Existing `run_periodic_updates()` automatically picks up new TrackedStock entries\n\nThese will become Celery task definitions.",
        "subsections": []
      },
      {
        "level": 3,
        "title": "3. API Integration",
        "content": "",
        "subsections": []
      },
      {
        "level": 4,
        "title": "A. Router Integration",
        "content": "- No changes needed to `cream_api/main.py` - stock data router already imported\n- Add new endpoints to existing `cream_api/stock_data/api.py`\n- Reference existing endpoint patterns like `/stock-data/track`\n\nThis will become router registration code.",
        "subsections": []
      },
      {
        "level": 4,
        "title": "B. Endpoint Implementation",
        "content": "- `POST /stock-data/request` - Submit stock tracking request (requires auth)\n- `GET /stock-data/tracked` - List all tracked stocks (admin only)\n- `PATCH /stock-data/tracked/{symbol}/deactivate` - Deactivate tracking (admin only)\n- Include specific request/response formats with field names\n- List specific auth requirements: `@requires_auth` for user endpoints, `@requires_admin` for admin endpoints\n\nThese will become FastAPI endpoint definitions.",
        "subsections": []
      },
      {
        "level": 3,
        "title": "4. Frontend Implementation",
        "content": "",
        "subsections": []
      },
      {
        "level": 4,
        "title": "A. API Client Functions",
        "content": "- `trackStock(symbol: string): Promise<TrackedStock>` - Request to track new stock\n- `getTrackedStocks(): Promise<TrackedStock[]>` - Get all tracked stocks (admin only)\n- `deactivateTracking(symbol: string): Promise<TrackedStock>` - Deactivate tracking (admin only)\n- Include specific TypeScript interfaces with field names\n\nThis will become the actual TypeScript API client code.",
        "subsections": []
      },
      {
        "level": 4,
        "title": "B. Pages",
        "content": "- **StockRequestPage**: `cream_ui/src/pages/stock-requests/StockRequestPage.tsx`\n- Describe specific form fields: stock symbol input with validation, submit button, loading state, success/error messages\n\nThis will become the React component implementation.",
        "subsections": []
      },
      {
        "level": 4,
        "title": "C. Components",
        "content": "- **StockRequestForm**: `cream_ui/src/components/stock-requests/StockRequestForm.tsx` with props: `onSubmit: (symbol: string) => void`\n- **StockSymbolInput**: `cream_ui/src/components/stock-requests/StockSymbolInput.tsx` with validation\n- **MessageDisplay**: `cream_ui/src/components/stock-requests/MessageDisplay.tsx` for success/error messages\n\nThis will become the React component with props interface.",
        "subsections": []
      },
      {
        "level": 3,
        "title": "5. User Experience Flow",
        "content": "",
        "subsections": []
      },
      {
        "level": 4,
        "title": "A. Primary User Flow",
        "content": "1. User navigates to `/stock-requests` page\n2. User sees form with stock symbol input field\n3. User enters stock symbol (validation: 1-10 uppercase letters)\n4. User clicks \"Track Stock\" button\n5. Form shows loading state during submission\n6. If successful, shows confirmation message with stock symbol\n7. If stock already tracked, shows \"already being tracked\" message\n8. If error, shows error message with details\n\nThis will inform the component state management and routing.",
        "subsections": []
      },
      {
        "level": 4,
        "title": "B. Alternative Flows (if applicable)",
        "content": "1. Invalid symbol shows error message with validation rules\n2. Admin sees additional management options in admin dashboard\n3. Network error shows retry option with fallback message\n\nThis will inform error handling and conditional rendering.",
        "subsections": []
      },
      {
        "level": 3,
        "title": "6. Integration Points",
        "content": "",
        "subsections": []
      },
      {
        "level": 4,
        "title": "A. Existing Systems",
        "content": "- Integrates with `cream_api/stock_data/` module using existing `TrackedStock` model\n- References existing functions: `update_all_tracked_stocks()` for background processing\n- Uses existing authentication system from `cream_api/users/`\n\nThis will inform import statements and function calls.",
        "subsections": []
      },
      {
        "level": 4,
        "title": "B. External Dependencies",
        "content": "- No new external dependencies required\n- Uses existing stock data retrieval system\n- Leverages existing authentication and authorization\n\nThis will inform requirements.txt and package.json updates.",
        "subsections": []
      },
      {
        "level": 4,
        "title": "C. Background Processing",
        "content": "- Uses existing `run_periodic_updates()` task from `cream_api/stock_data/tasks.py`\n- No additional task scheduling needed\n- References existing task patterns\n\nThis will inform Celery task definitions and scheduling.",
        "subsections": []
      },
      {
        "level": 2,
        "title": "Technical Considerations",
        "content": "",
        "subsections": []
      },
      {
        "level": 3,
        "title": "A. Security",
        "content": "- Input sanitization for stock symbols (uppercase letters only)\n- Rate limiting: 10 requests/minute per user\n- Admin-only access for management endpoints\n- Reference existing security patterns from `cream_api/common/`\n\nThis will inform input validation and security middleware.",
        "subsections": []
      },
      {
        "level": 3,
        "title": "B. Performance",
        "content": "- Simple form submission with minimal data processing\n- Database indexing on symbol field for fast lookups\n- Optimistic updates for better UX\n- Reference existing performance patterns\n\nThis will inform database migrations and query optimizations.",
        "subsections": []
      },
      {
        "level": 3,
        "title": "C. Error Handling",
        "content": "- Graceful handling of invalid stock symbols with clear error messages\n- Network timeout retry logic for API calls\n- Fallback states for network issues\n- Reference existing error handling patterns\n\nThis will inform try-catch blocks and error recovery code.",
        "subsections": []
      },
      {
        "level": 2,
        "title": "Implementation Phases",
        "content": "",
        "subsections": []
      },
      {
        "level": 3,
        "title": "Phase 1: Backend Schemas (Week 1)",
        "content": "1. Create `cream_api/stock_data/schemas.py` with StockRequestCreate and StockRequestResponse models\n2. Add validation for stock symbol format (uppercase letters, 1-10 characters)\n3. Write unit tests for new schemas in `tests/stock_data/test_schemas.py`\n\nEach task should correspond to specific code files to be created.",
        "subsections": []
      },
      {
        "level": 3,
        "title": "Phase 2: Frontend Implementation (Week 2)",
        "content": "1. Create `cream_ui/src/lib/api/stockRequests.ts` with API client functions\n2. Build StockRequestForm component with validation in `cream_ui/src/components/stock-requests/`\n3. Add error handling and loading states to all components\n4. Implement responsive design with shadcn/ui components\n\nEach task should correspond to specific component files to be created.",
        "subsections": []
      },
      {
        "level": 3,
        "title": "Phase 3: Integration & Testing (Week 3)",
        "content": "1. End-to-end testing of complete user flow with realistic scenarios\n2. Performance testing with 100 concurrent requests\n3. Update API documentation with new endpoints in OpenAPI/Swagger\n\nThese tasks will generate test files and documentation updates.",
        "subsections": []
      },
      {
        "level": 2,
        "title": "Testing Strategy",
        "content": "",
        "subsections": []
      },
      {
        "level": 3,
        "title": "A. Backend Tests",
        "content": "- Unit tests in `tests/stock_data/test_schemas.py` for validation logic\n- Integration tests in `tests/stock_data/test_api.py` for endpoint functionality\n- Test existing `/stock-data/track` endpoint integration\n- Reference existing test patterns from `tests/stock_data/`\n\nThese will become actual pytest test files and functions.",
        "subsections": []
      },
      {
        "level": 3,
        "title": "B. Frontend Tests",
        "content": "- Component tests in `cream_ui/src/components/__tests__/StockRequestForm.test.tsx`\n- Test scenarios: \"validates symbol format\", \"handles API errors\", \"shows loading states\"\n- API integration tests for all client functions\n- End-to-end tests for complete user flow\n\nThese will become actual Jest/React Testing Library test files.",
        "subsections": []
      },
      {
        "level": 3,
        "title": "C. Performance Tests",
        "content": "- API response time testing under load (100 concurrent requests)\n- Database query performance testing for symbol lookups\n- Frontend component rendering performance tests\n\nThese will become actual load testing scripts.",
        "subsections": []
      },
      {
        "level": 2,
        "title": "Documentation Updates",
        "content": "",
        "subsections": []
      },
      {
        "level": 3,
        "title": "A. API Documentation",
        "content": "- Add `/stock-data/request` endpoint to OpenAPI/Swagger documentation\n- Add `/stock-data/tracked` endpoint for admin access\n- Include request/response examples for each endpoint\n- Document error codes and messages for all scenarios\n\nThese will become actual OpenAPI schema updates.",
        "subsections": []
      },
      {
        "level": 3,
        "title": "B. User Documentation",
        "content": "- Update user guide with stock tracking feature instructions\n- Add troubleshooting guide for common errors (invalid symbols, network issues)\n- Create admin documentation for stock management features\n\nThese will become actual documentation file updates.",
        "subsections": []
      },
      {
        "level": 2,
        "title": "Success Criteria",
        "content": "1. Users can successfully request stock tracking with 95% success rate\n2. Form provides feedback within 2 seconds for all interactions\n3. API endpoints respond within 200ms for stock request submissions\n4. 90% test coverage for all new code components\n5. All new endpoints documented in OpenAPI with examples\n6. Error handling covers 100% of failure scenarios\n7. Admin interface provides full stock management capabilities\n8. Integration with existing stock data pipeline works seamlessly\n\nAll criteria must be measurable and testable.",
        "subsections": []
      },
      {
        "level": 2,
        "title": "Risks and Mitigation",
        "content": "| Risk     | Impact   | Probability   | Mitigation Strategy |\n| -------- | -------- | ------------- | ------------------- |\n| Invalid stock symbols cause API errors | API returns 500 errors | Medium | Add comprehensive input validation and error handling |\n| Duplicate requests overwhelm system | Performance degradation | Low | Implement rate limiting and duplicate prevention |\n| Admin interface security issues | Unauthorized access | Medium | Implement proper admin authentication and authorization |\n| Integration with existing pipeline fails | Stock data not updated | Low | Thorough testing of integration points and fallback mechanisms |\n\nMitigation strategies should inform actual code implementation.",
        "subsections": []
      },
      {
        "level": 2,
        "title": "Review Checklist",
        "content": "- [x] Business requirements reviewed and approved\n- [x] Technical design reviewed against existing patterns\n- [x] Security review completed with specific measures identified\n- [x] Performance requirements validated with specific metrics\n- [x] UI/UX design approved with specific user flows\n- [ ] Documentation completed for all new components\n- [ ] Test cases reviewed with specific coverage requirements\n- [ ] Deployment plan approved with specific steps\n- [x] Integration points validated against existing systems\n- [x] User experience flows tested with specific scenarios",
        "subsections": []
      },
      {
        "level": 2,
        "title": "Notes",
        "content": "This feature leverages the existing stock data infrastructure, requiring minimal new code while providing significant user value. The implementation focuses on reusing existing patterns and components to ensure consistency and maintainability.\n\n**AI Guidance**: Document any assumptions, decisions, or considerations that might affect implementation.\n\nNotes should inform implementation decisions and code comments.",
        "subsections": []
      },
      {
        "level": 2,
        "title": "References",
        "content": "- `../project_context/Architecture%20Overview.json.replace(\".json\", \".json\")` - System architecture and component relationships\n- `../project_context/Common%20Patterns.json.replace(\".json\", \".json\")` - Project-specific patterns and conventions\n- `../summaries/stock_data_module_summary.json.replace(\".json\", \".json\")` - Detailed stock data module analysis\n- `../guide_docs/Core%20Principles.json.replace(\".json\", \".json\")` - Decision-making frameworks\n- Existing `TrackedStock` model in `cream_api/stock_data/models.py`\n- Existing stock data API patterns in `cream_api/stock_data/api.py`\n\n---\n\n**AI Quality Checklist**: Before completing this template, ensure:\n- [x] All placeholders are replaced with specific, actionable content\n- [x] File paths and module names reference actual codebase structure\n- [x] Requirements are specific and testable\n- [x] Implementation plan references existing patterns\n- [x] Success criteria are measurable\n- [x] All sections are complete and consistent\n- [x] Code generation hints are actionable\n- [x] Validation rules are satisfied\n- [x] Dependencies are properly referenced\n```",
        "subsections": []
      }
    ],
    "code_blocks": [],
    "links": [
      {
        "type": "code_reference",
        "text": "../project_context/Architecture%20Overview.md"
      },
      {
        "type": "code_reference",
        "text": "../project_context/Common%20Patterns.md"
      },
      {
        "type": "code_reference",
        "text": "../project_context/Development%20Workflow.md"
      },
      {
        "type": "code_reference",
        "text": "../summaries/stock_data_module_summary.md"
      },
      {
        "type": "code_reference",
        "text": "../guide_docs/Core%20Principles.md"
      },
      {
        "type": "code_reference",
        "text": "cream_api/stock_data/models.py"
      },
      {
        "type": "code_reference",
        "text": "cream_api/stock_data/api.py"
      },
      {
        "type": "code_reference",
        "text": "cream_api/main.py"
      },
      {
        "type": "code_reference",
        "text": "../project_context/Architecture%20Overview.md"
      },
      {
        "type": "code_reference",
        "text": "cream_api/stock_data/models.py"
      },
      {
        "type": "code_reference",
        "text": "symbol: str = Field(..., min_length=1, max_length=10, regex=r'^[A-Z]+$')"
      },
      {
        "type": "code_reference",
        "text": "cream_api/common/exceptions.py"
      },
      {
        "type": "code_reference",
        "text": "cream_api/stock_data/tasks.py"
      },
      {
        "type": "code_reference",
        "text": "cream_api/main.py"
      },
      {
        "type": "code_reference",
        "text": "cream_api/stock_data/api.py"
      },
      {
        "type": "code_reference",
        "text": "cream_ui/src/pages/stock-requests/StockRequestPage.tsx"
      },
      {
        "type": "code_reference",
        "text": "cream_ui/src/components/stock-requests/StockRequestForm.tsx"
      },
      {
        "type": "code_reference",
        "text": "cream_ui/src/components/stock-requests/StockSymbolInput.tsx"
      },
      {
        "type": "code_reference",
        "text": "cream_ui/src/components/stock-requests/MessageDisplay.tsx"
      },
      {
        "type": "code_reference",
        "text": "cream_api/stock_data/tasks.py"
      },
      {
        "type": "code_reference",
        "text": "cream_api/stock_data/schemas.py"
      },
      {
        "type": "code_reference",
        "text": "tests/stock_data/test_schemas.py"
      },
      {
        "type": "code_reference",
        "text": "cream_ui/src/lib/api/stockRequests.ts"
      },
      {
        "type": "code_reference",
        "text": "tests/stock_data/test_schemas.py"
      },
      {
        "type": "code_reference",
        "text": "tests/stock_data/test_api.py"
      },
      {
        "type": "code_reference",
        "text": "cream_ui/src/components/__tests__/StockRequestForm.test.tsx"
      },
      {
        "type": "code_reference",
        "text": "../project_context/Architecture%20Overview.md"
      },
      {
        "type": "code_reference",
        "text": "../project_context/Common%20Patterns.md"
      },
      {
        "type": "code_reference",
        "text": "../summaries/stock_data_module_summary.md"
      },
      {
        "type": "code_reference",
        "text": "../guide_docs/Core%20Principles.md"
      },
      {
        "type": "code_reference",
        "text": "cream_api/stock_data/models.py"
      },
      {
        "type": "code_reference",
        "text": "cream_api/stock_data/api.py"
      }
    ],
    "raw_content": "# Stock Tracking Request Plan\n\n> This document outlines the plan for implementing stock tracking request functionality. Use this for understanding the planned implementation and requirements.\n\n## AI Metadata\n\n**Template Version:** 2.1\n**AI Processing Level:** High\n**Required Context:** Project architecture, existing patterns, technical summaries\n**Validation Required:** Yes\n**Code Generation:** Supported\n\n**Dependencies:**\n- `../project_context/Architecture%20Overview.md` - System architecture\n- `../project_context/Common%20Patterns.md` - Project patterns\n- `../project_context/Development%20Workflow.md` - Development process\n- `../summaries/stock_data_module_summary.md` - Stock data module details\n- `../guide_docs/Core%20Principles.md` - Decision frameworks\n\n**Validation Rules:**\n- All placeholders must be replaced with specific content\n- File paths must reference actual codebase structure\n- Requirements must be measurable and testable\n- Implementation plan must reference existing patterns\n- Success criteria must be quantifiable\n\n## Overview\n\n**Feature Name:** Stock Tracking Request UI\n**Status:** In Progress\n**Priority:** Medium\n**Target Release:** Sprint 3\n\n**AI Context:** This section establishes the feature identity and scope. Use consistent naming conventions from existing features.\n\n## Description\n\nThis feature will allow authenticated users to request that the system track specific stocks on their behalf. All backend logic will be contained within the `cream_api/stock_data` module, following the established project patterns.\n\n**AI Guidance**: Be specific about what the feature does, who uses it, and what problem it solves. Reference existing features for similar patterns.\n\nThis description should inform the implementation plan and user stories.\n\n## Business Value\n\n- **User Engagement**: Increases user interaction with the platform by allowing them to request stock tracking\n- **Data Coverage**: Expands the range of stocks being tracked based on user demand\n- **User Satisfaction**: Provides users with control over which stocks are monitored\n- **Platform Growth**: Encourages users to return to check on their requested stocks\n\n**AI Guidance**: Connect to existing business goals. Reference similar features' impact if applicable.\n\nEach benefit should be measurable or observable.\n\n## User Stories\n\n- As a **registered user**, I want to **request that a specific stock be tracked** so that **I can monitor stocks I'm interested in**\n- As a **registered user**, I want to **see confirmation when my request is processed** so that **I know the system is working on my request**\n- As an **admin user**, I want to **view all tracked stocks and their status** so that **I can manage the tracking system**\n- As an **admin user**, I want to **deactivate tracking for specific stocks** so that **I can control system resources**\n\n**AI Guidance**: Use existing user types from the system. Make stories specific and testable.\n\nThese stories will inform the user experience flow and acceptance criteria.\n\nEach story should be testable and have clear acceptance criteria.\n\n## Architecture Analysis\n\nBased on the current project structure:\n- **Backend**: All stock-related logic in `cream_api/stock_data/` module\n- **Models**: Stock models in `cream_api/stock_data/models.py` (TrackedStock model)\n- **API**: Endpoints defined in `cream_api/stock_data/api.py`, router in `cream_api/main.py`\n- **Frontend**: React/TypeScript with shadcn/ui components in `cream_ui/src/`\n\n**AI Guidance**: Reference actual files and modules from the codebase. Use `../project_context/Architecture%20Overview.md` for context.\n\nThis analysis will determine which files need to be created or modified.\n\nAll listed files and modules must exist in the codebase.\n\n## Technical Requirements\n\n### Functional Requirements\n\n- **Stock Request Creation**: Users can submit stock symbol requests with validation\n- **Duplicate Prevention**: System prevents tracking the same stock multiple times\n- **Request Confirmation**: Users receive immediate feedback on request status\n- **Admin Management**: Admins can view and manage all tracked stocks\n- **Integration with Existing Pipeline**: New requests integrate with existing stock data processing\n\n**AI Guidance**: Make requirements specific enough that they can be implemented and tested. Reference existing patterns.\n\nThese requirements will become test cases and implementation tasks.\n\nEach requirement must have clear acceptance criteria.\n\n### Non-Functional Requirements\n\n- **Performance**: API response time < 200ms for stock request submission\n- **Security**: Rate limiting of 10 requests/minute per user, input sanitization for stock symbols\n- **Scalability**: Support 100 concurrent stock request submissions\n- **Compatibility**: Works with existing authentication system and protected routes\n\n**AI Guidance**: Use measurable, specific requirements. Reference existing performance patterns.\n\nThese requirements will inform technical considerations and testing strategy.\n\nAll requirements must be measurable or verifiable.\n\n## Implementation Plan\n\n### 1. Database Schema Changes\n\n#### Update `cream_api/stock_data/models.py`\nNo new models needed - use existing `TrackedStock` model:\n\n- **TrackedStock Model**: Already exists and tracks stocks globally\n  - Fields: `id: int, symbol: str, last_pull_date: datetime, last_pull_status: str, error_message: str, is_active: bool`\n  - Unique constraint on symbol (prevents duplicate tracking)\n  - **Purpose**: Track which stocks are being monitored by the system\n  - **Relationships**: No new relationships needed\n\n**AI Guidance**: Reference existing models for field patterns. Use consistent naming conventions.\n\nThis will become the actual SQLAlchemy model definition.\n\nField types must match existing patterns, relationships must be valid.\n\nThe existing `TrackedStock` model is sufficient for our use case. When a user requests a stock:\n1. If the stock is already being tracked (exists in TrackedStock), the request is approved immediately\n2. If the stock is not being tracked, create a new TrackedStock entry and approve the request\n3. All users benefit from stocks being tracked, regardless of who requested them\n\n### 2. Backend Implementation\n\n#### A. Models\n- No changes needed to existing `TrackedStock` model\n- Use existing model with fields: `id`, `symbol`, `last_pull_date`, `last_pull_status`, `error_message`, `is_active`\n\nReference existing model patterns for consistency.\n\n#### B. Schemas\n- **StockRequestCreate**: `symbol: str = Field(..., min_length=1, max_length=10, regex=r'^[A-Z]+$')`\n- **StockRequestResponse**: Based on TrackedStock model with fields: `id`, `symbol`, `is_active`, `last_pull_date`\n- Include validation for symbol format (uppercase letters only) and length (1-10 characters)\n\nThis will become the actual Pydantic schema definition.\n\n#### C. Business Logic\n- `def process_stock_request(symbol: str, user_id: int) -> TrackedStock:` - Process user stock request\n- `def get_tracked_stocks() -> List[TrackedStock]:` - Get all tracked stocks (admin only)\n- `def deactivate_stock_tracking(symbol: str) -> TrackedStock:` - Deactivate tracking (admin only)\n- Reference existing patterns from `cream_api/stock_data/` module\n\nThese will become the actual function implementations.\n\n#### D. Error Handling\n- `StockAlreadyTrackedError` - When stock is already being tracked\n- `InvalidStockSymbolError` - When symbol format is invalid\n- `StockNotFoundError` - When stock doesn't exist in external API\n- Reference existing error patterns from `cream_api/common/exceptions.py`\n\nThese will become exception class definitions.\n\n#### E. Background Tasks\n- No additional tasks needed - use existing `update_all_tracked_stocks()` from `cream_api/stock_data/tasks.py`\n- Existing `run_periodic_updates()` automatically picks up new TrackedStock entries\n\nThese will become Celery task definitions.\n\n### 3. API Integration\n\n#### A. Router Integration\n- No changes needed to `cream_api/main.py` - stock data router already imported\n- Add new endpoints to existing `cream_api/stock_data/api.py`\n- Reference existing endpoint patterns like `/stock-data/track`\n\nThis will become router registration code.\n\n#### B. Endpoint Implementation\n- `POST /stock-data/request` - Submit stock tracking request (requires auth)\n- `GET /stock-data/tracked` - List all tracked stocks (admin only)\n- `PATCH /stock-data/tracked/{symbol}/deactivate` - Deactivate tracking (admin only)\n- Include specific request/response formats with field names\n- List specific auth requirements: `@requires_auth` for user endpoints, `@requires_admin` for admin endpoints\n\nThese will become FastAPI endpoint definitions.\n\n### 4. Frontend Implementation\n\n#### A. API Client Functions\n- `trackStock(symbol: string): Promise<TrackedStock>` - Request to track new stock\n- `getTrackedStocks(): Promise<TrackedStock[]>` - Get all tracked stocks (admin only)\n- `deactivateTracking(symbol: string): Promise<TrackedStock>` - Deactivate tracking (admin only)\n- Include specific TypeScript interfaces with field names\n\nThis will become the actual TypeScript API client code.\n\n#### B. Pages\n- **StockRequestPage**: `cream_ui/src/pages/stock-requests/StockRequestPage.tsx`\n- Describe specific form fields: stock symbol input with validation, submit button, loading state, success/error messages\n\nThis will become the React component implementation.\n\n#### C. Components\n- **StockRequestForm**: `cream_ui/src/components/stock-requests/StockRequestForm.tsx` with props: `onSubmit: (symbol: string) => void`\n- **StockSymbolInput**: `cream_ui/src/components/stock-requests/StockSymbolInput.tsx` with validation\n- **MessageDisplay**: `cream_ui/src/components/stock-requests/MessageDisplay.tsx` for success/error messages\n\nThis will become the React component with props interface.\n\n### 5. User Experience Flow\n\n#### A. Primary User Flow\n1. User navigates to `/stock-requests` page\n2. User sees form with stock symbol input field\n3. User enters stock symbol (validation: 1-10 uppercase letters)\n4. User clicks \"Track Stock\" button\n5. Form shows loading state during submission\n6. If successful, shows confirmation message with stock symbol\n7. If stock already tracked, shows \"already being tracked\" message\n8. If error, shows error message with details\n\nThis will inform the component state management and routing.\n\n#### B. Alternative Flows (if applicable)\n1. Invalid symbol shows error message with validation rules\n2. Admin sees additional management options in admin dashboard\n3. Network error shows retry option with fallback message\n\nThis will inform error handling and conditional rendering.\n\n### 6. Integration Points\n\n#### A. Existing Systems\n- Integrates with `cream_api/stock_data/` module using existing `TrackedStock` model\n- References existing functions: `update_all_tracked_stocks()` for background processing\n- Uses existing authentication system from `cream_api/users/`\n\nThis will inform import statements and function calls.\n\n#### B. External Dependencies\n- No new external dependencies required\n- Uses existing stock data retrieval system\n- Leverages existing authentication and authorization\n\nThis will inform requirements.txt and package.json updates.\n\n#### C. Background Processing\n- Uses existing `run_periodic_updates()` task from `cream_api/stock_data/tasks.py`\n- No additional task scheduling needed\n- References existing task patterns\n\nThis will inform Celery task definitions and scheduling.\n\n## Technical Considerations\n\n### A. Security\n- Input sanitization for stock symbols (uppercase letters only)\n- Rate limiting: 10 requests/minute per user\n- Admin-only access for management endpoints\n- Reference existing security patterns from `cream_api/common/`\n\nThis will inform input validation and security middleware.\n\n### B. Performance\n- Simple form submission with minimal data processing\n- Database indexing on symbol field for fast lookups\n- Optimistic updates for better UX\n- Reference existing performance patterns\n\nThis will inform database migrations and query optimizations.\n\n### C. Error Handling\n- Graceful handling of invalid stock symbols with clear error messages\n- Network timeout retry logic for API calls\n- Fallback states for network issues\n- Reference existing error handling patterns\n\nThis will inform try-catch blocks and error recovery code.\n\n## Implementation Phases\n\n### Phase 1: Backend Schemas (Week 1)\n1. Create `cream_api/stock_data/schemas.py` with StockRequestCreate and StockRequestResponse models\n2. Add validation for stock symbol format (uppercase letters, 1-10 characters)\n3. Write unit tests for new schemas in `tests/stock_data/test_schemas.py`\n\nEach task should correspond to specific code files to be created.\n\n### Phase 2: Frontend Implementation (Week 2)\n1. Create `cream_ui/src/lib/api/stockRequests.ts` with API client functions\n2. Build StockRequestForm component with validation in `cream_ui/src/components/stock-requests/`\n3. Add error handling and loading states to all components\n4. Implement responsive design with shadcn/ui components\n\nEach task should correspond to specific component files to be created.\n\n### Phase 3: Integration & Testing (Week 3)\n1. End-to-end testing of complete user flow with realistic scenarios\n2. Performance testing with 100 concurrent requests\n3. Update API documentation with new endpoints in OpenAPI/Swagger\n\nThese tasks will generate test files and documentation updates.\n\n## Testing Strategy\n\n### A. Backend Tests\n- Unit tests in `tests/stock_data/test_schemas.py` for validation logic\n- Integration tests in `tests/stock_data/test_api.py` for endpoint functionality\n- Test existing `/stock-data/track` endpoint integration\n- Reference existing test patterns from `tests/stock_data/`\n\nThese will become actual pytest test files and functions.\n\n### B. Frontend Tests\n- Component tests in `cream_ui/src/components/__tests__/StockRequestForm.test.tsx`\n- Test scenarios: \"validates symbol format\", \"handles API errors\", \"shows loading states\"\n- API integration tests for all client functions\n- End-to-end tests for complete user flow\n\nThese will become actual Jest/React Testing Library test files.\n\n### C. Performance Tests\n- API response time testing under load (100 concurrent requests)\n- Database query performance testing for symbol lookups\n- Frontend component rendering performance tests\n\nThese will become actual load testing scripts.\n\n## Documentation Updates\n\n### A. API Documentation\n- Add `/stock-data/request` endpoint to OpenAPI/Swagger documentation\n- Add `/stock-data/tracked` endpoint for admin access\n- Include request/response examples for each endpoint\n- Document error codes and messages for all scenarios\n\nThese will become actual OpenAPI schema updates.\n\n### B. User Documentation\n- Update user guide with stock tracking feature instructions\n- Add troubleshooting guide for common errors (invalid symbols, network issues)\n- Create admin documentation for stock management features\n\nThese will become actual documentation file updates.\n\n## Success Criteria\n\n1. Users can successfully request stock tracking with 95% success rate\n2. Form provides feedback within 2 seconds for all interactions\n3. API endpoints respond within 200ms for stock request submissions\n4. 90% test coverage for all new code components\n5. All new endpoints documented in OpenAPI with examples\n6. Error handling covers 100% of failure scenarios\n7. Admin interface provides full stock management capabilities\n8. Integration with existing stock data pipeline works seamlessly\n\nAll criteria must be measurable and testable.\n\n## Risks and Mitigation\n\n| Risk     | Impact   | Probability   | Mitigation Strategy |\n| -------- | -------- | ------------- | ------------------- |\n| Invalid stock symbols cause API errors | API returns 500 errors | Medium | Add comprehensive input validation and error handling |\n| Duplicate requests overwhelm system | Performance degradation | Low | Implement rate limiting and duplicate prevention |\n| Admin interface security issues | Unauthorized access | Medium | Implement proper admin authentication and authorization |\n| Integration with existing pipeline fails | Stock data not updated | Low | Thorough testing of integration points and fallback mechanisms |\n\nMitigation strategies should inform actual code implementation.\n\n## Review Checklist\n\n- [x] Business requirements reviewed and approved\n- [x] Technical design reviewed against existing patterns\n- [x] Security review completed with specific measures identified\n- [x] Performance requirements validated with specific metrics\n- [x] UI/UX design approved with specific user flows\n- [ ] Documentation completed for all new components\n- [ ] Test cases reviewed with specific coverage requirements\n- [ ] Deployment plan approved with specific steps\n- [x] Integration points validated against existing systems\n- [x] User experience flows tested with specific scenarios\n\n## Notes\n\nThis feature leverages the existing stock data infrastructure, requiring minimal new code while providing significant user value. The implementation focuses on reusing existing patterns and components to ensure consistency and maintainability.\n\n**AI Guidance**: Document any assumptions, decisions, or considerations that might affect implementation.\n\nNotes should inform implementation decisions and code comments.\n\n## References\n\n- `../project_context/Architecture%20Overview.md` - System architecture and component relationships\n- `../project_context/Common%20Patterns.md` - Project-specific patterns and conventions\n- `../summaries/stock_data_module_summary.md` - Detailed stock data module analysis\n- `../guide_docs/Core%20Principles.md` - Decision-making frameworks\n- Existing `TrackedStock` model in `cream_api/stock_data/models.py`\n- Existing stock data API patterns in `cream_api/stock_data/api.py`\n\n---\n\n**AI Quality Checklist**: Before completing this template, ensure:\n- [x] All placeholders are replaced with specific, actionable content\n- [x] File paths and module names reference actual codebase structure\n- [x] Requirements are specific and testable\n- [x] Implementation plan references existing patterns\n- [x] Success criteria are measurable\n- [x] All sections are complete and consistent\n- [x] Code generation hints are actionable\n- [x] Validation rules are satisfied\n- [x] Dependencies are properly referenced\n```\n"
  },
  "cross_references": [],
  "code_generation_hints": [
    {
      "context": "general",
      "hint": "This description should inform the implementation plan and user stories.",
      "validation": ""
    },
    {
      "context": "general",
      "hint": "These stories will inform the user experience flow and acceptance criteria.",
      "validation": ""
    },
    {
      "context": "general",
      "hint": "This analysis will determine which files need to be created or modified.",
      "validation": ""
    },
    {
      "context": "testing",
      "hint": "These requirements will become test cases and implementation tasks.",
      "validation": ""
    },
    {
      "context": "testing",
      "hint": "These requirements will inform technical considerations and testing strategy.",
      "validation": ""
    },
    {
      "context": "general",
      "hint": "This will become the actual SQLAlchemy model definition.",
      "validation": ""
    },
    {
      "context": "general",
      "hint": "Reference existing model patterns for consistency.",
      "validation": ""
    },
    {
      "context": "general",
      "hint": "This will become the actual Pydantic schema definition.",
      "validation": ""
    },
    {
      "context": "general",
      "hint": "These will become the actual function implementations.",
      "validation": ""
    },
    {
      "context": "general",
      "hint": "These will become exception class definitions.",
      "validation": ""
    },
    {
      "context": "general",
      "hint": "These will become Celery task definitions.",
      "validation": ""
    },
    {
      "context": "general",
      "hint": "This will become router registration code.",
      "validation": ""
    },
    {
      "context": "general",
      "hint": "These will become FastAPI endpoint definitions.",
      "validation": ""
    },
    {
      "context": "general",
      "hint": "This will become the actual TypeScript API client code.",
      "validation": ""
    },
    {
      "context": "general",
      "hint": "This will become the React component implementation.",
      "validation": ""
    },
    {
      "context": "general",
      "hint": "This will become the React component with props interface.",
      "validation": ""
    },
    {
      "context": "general",
      "hint": "This will inform the component state management and routing.",
      "validation": ""
    },
    {
      "context": "error handling",
      "hint": "This will inform error handling and conditional rendering.",
      "validation": ""
    },
    {
      "context": "import organization",
      "hint": "This will inform import statements and function calls.",
      "validation": ""
    },
    {
      "context": "general",
      "hint": "This will inform requirements.txt and package.json updates.",
      "validation": ""
    },
    {
      "context": "general",
      "hint": "This will inform Celery task definitions and scheduling.",
      "validation": ""
    },
    {
      "context": "general",
      "hint": "This will inform input validation and security middleware.",
      "validation": ""
    },
    {
      "context": "general",
      "hint": "This will inform database migrations and query optimizations.",
      "validation": ""
    },
    {
      "context": "error handling",
      "hint": "This will inform try-catch blocks and error recovery code.",
      "validation": ""
    },
    {
      "context": "general",
      "hint": "Each task should correspond to specific code files to be created.",
      "validation": ""
    },
    {
      "context": "general",
      "hint": "Each task should correspond to specific component files to be created.",
      "validation": ""
    },
    {
      "context": "testing",
      "hint": "These tasks will generate test files and documentation updates.",
      "validation": ""
    },
    {
      "context": "testing",
      "hint": "These will become actual pytest test files and functions.",
      "validation": ""
    },
    {
      "context": "testing",
      "hint": "These will become actual Jest/React Testing Library test files.",
      "validation": ""
    },
    {
      "context": "testing",
      "hint": "These will become actual load testing scripts.",
      "validation": ""
    },
    {
      "context": "general",
      "hint": "These will become actual OpenAPI schema updates.",
      "validation": ""
    },
    {
      "context": "general",
      "hint": "These will become actual documentation file updates.",
      "validation": ""
    },
    {
      "context": "general",
      "hint": "Mitigation strategies should inform actual code implementation.",
      "validation": ""
    },
    {
      "context": "general",
      "hint": "Notes should inform implementation decisions and code comments.",
      "validation": ""
    }
  ],
  "validation_rules": [
    "All requirements must be measurable or verifiable",
    "Field types must match existing patterns, relationships must be valid",
    "Success criteria must be quantifiable",
    "All listed files and modules must exist in the codebase",
    "Each benefit should be measurable or observable",
    "All criteria must be measurable and testable",
    "Implementation plan must reference existing patterns",
    "Each story should be testable and have clear acceptance criteria",
    "Requirements must be measurable and testable",
    "No new external dependencies required",
    "File paths must reference actual codebase structure",
    "All placeholders must be replaced with specific content",
    "Each requirement must have clear acceptance criteria"
  ],
  "optimization": {
    "version": "1.0",
    "optimized_at": "2025-06-18T19:19:47.733185",
    "improvements": [
      "fixed_file_references",
      "extracted_ai_metadata",
      "structured_cross_references",
      "extracted_code_hints",
      "structured_validation_rules"
    ],
    "literal_strings_cleaned": true,
    "cleaned_at": "2025-06-18T19:30:00.000000"
  }
}