{
  "ai_metadata": {
    "purpose": "",
    "last_updated": "",
    "template_version": "2.1",
    "ai_tool_compatibility": "",
    "ai_processing_level": "High",
    "required_context": "Project architecture, existing patterns, implementation details",
    "validation_required": "Yes",
    "code_generation": "Supported",
    "cross_references": [
      "../project_context/Architecture%20Overview.json",
      "../project_context/Common%20Patterns.json",
      "../project_context/Development%20Workflow.json",
      "../guide_docs/Core%20Principles.json",
      "../plans/[IN-PROGRESS]-Stock%20Tracking%20Request%20Plan.json"
    ],
    "maintenance": ""
  },
  "file_info": {
    "file_path": "features/summaries/[COMPLETED]-stock_data_processing_pipeline_summary.md",
    "original_format": "markdown",
    "converted_at": "2025-06-18T19:14:30.269576",
    "file_size": 18595,
    "line_count": 491,
    "optimized_at": "2025-06-18T19:19:47.731106",
    "optimization_version": "1.0"
  },
  "content": {
    "sections": [
      {
        "level": 1,
        "title": "Stock Data Processing Pipeline Summary",
        "content": "> This document summarizes the completed stock data processing pipeline implementation. Use this for understanding the implemented solution and its components.",
        "subsections": []
      },
      {
        "level": 2,
        "title": "AI Metadata",
        "content": "**Template Version:** 2.1\n**AI Processing Level:** High\n**Required Context:** Project architecture, existing patterns, implementation details\n**Validation Required:** Yes\n**Code Generation:** Supported\n\n**Dependencies:**\n- `../project_context/Architecture%20Overview.json.replace(\".json\", \".json\")` - System architecture\n- `../project_context/Common%20Patterns.json.replace(\".json\", \".json\")` - Project patterns\n- `../project_context/Development%20Workflow.json.replace(\".json\", \".json\")` - Development process\n- `../guide_docs/Core%20Principles.json.replace(\".json\", \".json\")` - Decision frameworks\n- `../plans/[IN-PROGRESS]-Stock%20Tracking%20Request%20Plan.json.replace(\".json\", \".json\")` - Related feature plan\n\n**Validation Rules:**\n- All file paths must reference actual codebase structure\n- Implementation details must be specific and actionable\n- Performance characteristics must be measurable\n- Integration points must reference existing systems\n- Code generation hints must be actionable",
        "subsections": []
      },
      {
        "level": 2,
        "title": "Overview",
        "content": "**Module Name:** Stock Data Processing Pipeline\n**Status:** Completed Implementation\n**Last Updated:** Current\n**Related Features:** Stock Tracking Request UI (planned)\n\n**AI Context:** This module serves as the foundation for stock data processing and will be extended by the Stock Tracking Request UI feature. The existing architecture provides a solid base for user-driven stock tracking requests while maintaining the current automated processing capabilities.",
        "subsections": []
      },
      {
        "level": 2,
        "title": "Architecture",
        "content": "",
        "subsections": []
      },
      {
        "level": 3,
        "title": "Core Components",
        "content": "",
        "subsections": []
      },
      {
        "level": 4,
        "title": "1. **Configuration (`cream_api/stock_data/config.py`)**",
        "content": "- **Purpose**: Centralized configuration management for the entire module\n- **Key Features**:\n  - Pydantic-based configuration with validation\n  - Automatic directory creation for raw and parsed responses\n  - Configurable HTTP request parameters (timeout, retries, user agent)\n  - Default configuration with override capabilities\n\nThis will become the actual Pydantic configuration class with field definitions and validation.\n\nConfiguration fields must match existing patterns, validation rules must be comprehensive.",
        "subsections": []
      },
      {
        "level": 4,
        "title": "2. **Data Models (`cream_api/stock_data/models.py`)**",
        "content": "- **StockData**: Core model for historical price data\n  - Fields: `id: int, symbol: str, date: date, open: float, high: float, low: float, close: float, adj_close: float, volume: int`\n  - Unique constraint on `(symbol, date)` combination\n  - Indexed fields for efficient querying\n- **TrackedStock**: Model for managing stock tracking status\n  - Fields: `id: int, symbol: str, last_pull_date: datetime, last_pull_status: str, error_message: str, is_active: bool`\n  - Tracks last pull date, status, error messages\n  - Supports active/inactive tracking states\n  - Unique constraint on symbol\n\nThese will become the actual SQLAlchemy model definitions with proper relationships and constraints.\n\nField types must match existing patterns, relationships must be valid, constraints must be properly defined.",
        "subsections": []
      },
      {
        "level": 4,
        "title": "3. **Data Retrieval (`cream_api/stock_data/retriever.py`)**",
        "content": "- **StockDataRetriever**: Asynchronous HTTP client for Yahoo Finance\n- **Key Features**:\n  - Robust retry logic with exponential backoff\n  - Rate limiting handling (429 responses)\n  - Comprehensive error handling for network issues\n  - Automatic HTML content saving to files\n  - Configurable user agent and headers\n\nThis will become the actual aiohttp client implementation with retry logic and error handling.\n\nHTTP client must handle all error scenarios, retry logic must be configurable, file saving must be reliable.",
        "subsections": []
      },
      {
        "level": 4,
        "title": "4. **Data Parsing (`cream_api/stock_data/parser.py`)**",
        "content": "- **StockDataParser**: HTML parsing and data extraction\n- **Key Features**:\n  - BeautifulSoup-based HTML parsing\n  - Dividend and stock split row filtering\n  - Data validation and cleaning\n  - Column mapping and normalization\n  - Price relationship validation (high >= low, etc.)\n\nThis will become the actual BeautifulSoup parsing implementation with data validation logic.\n\nParsing must handle all HTML variations, data validation must be comprehensive, error handling must be robust.",
        "subsections": []
      },
      {
        "level": 4,
        "title": "5. **Data Loading (`cream_api/stock_data/loader.py`)**",
        "content": "- **StockDataLoader**: Database operations and data transformation\n- **Key Features**:\n  - Async database session management\n  - Data validation before storage\n  - Volume data cleaning and normalization\n  - Batch processing capabilities\n  - Error handling for invalid data\n\nThis will become the actual SQLAlchemy async session management with data transformation logic.\n\nDatabase operations must be efficient, data validation must prevent invalid data, error handling must be comprehensive.",
        "subsections": []
      },
      {
        "level": 4,
        "title": "6. **File Processing (`cream_api/stock_data/processor.py`)**",
        "content": "- **FileProcessor**: Orchestrates the complete data pipeline\n- **Key Features**:\n  - Coordinates parsing and loading operations\n  - File movement between raw and parsed directories\n  - Invalid file handling and cleanup\n  - Error recovery mechanisms\n\nThis will become the actual pipeline orchestration code with file management and error recovery.\n\nPipeline must be reliable, file management must be atomic, error recovery must be comprehensive.",
        "subsections": []
      },
      {
        "level": 4,
        "title": "7. **Background Tasks (`cream_api/stock_data/tasks.py`)**",
        "content": "- **Async task management for automated operations**\n- **Key Features**:\n  - Periodic stock data updates\n  - Batch processing of tracked stocks\n  - Status tracking and error reporting\n  - Configurable update intervals\n\nThis will become the actual Celery task definitions with scheduling and error handling.\n\nTasks must be reliable, scheduling must be configurable, error reporting must be comprehensive.",
        "subsections": []
      },
      {
        "level": 4,
        "title": "8. **API Endpoints (`cream_api/stock_data/api.py`)**",
        "content": "- **FastAPI router for stock data operations**\n- **Current Endpoints**:\n  - `POST /stock-data/track`: Add new stock to tracking\n- **Features**:\n  - Background task integration\n  - Database session management\n  - Error handling and rollback\n\nThis will become the actual FastAPI endpoint definitions with proper request/response models.\n\nEndpoints must be secure, error handling must be comprehensive, response models must be properly defined.",
        "subsections": []
      },
      {
        "level": 2,
        "title": "Data Flow",
        "content": "",
        "subsections": []
      },
      {
        "level": 3,
        "title": "1. **Stock Tracking Workflow**",
        "content": "```\nUser Request → API Endpoint → Database Check → Create TrackedStock → Background Task\n```\n\nThis workflow will inform the API endpoint implementation and background task integration.",
        "subsections": []
      },
      {
        "level": 3,
        "title": "2. **Data Retrieval Workflow**",
        "content": "```\nSymbol → HTTP Request → Yahoo Finance → HTML Response → File Save → Processing\n```\n\nThis workflow will inform the HTTP client implementation and file management logic.",
        "subsections": []
      },
      {
        "level": 3,
        "title": "3. **Data Processing Workflow**",
        "content": "```\nRaw HTML File → Parser → Validated Data → Loader → Database Storage → File Cleanup\n```\n\nThis workflow will inform the pipeline orchestration and data transformation logic.",
        "subsections": []
      },
      {
        "level": 2,
        "title": "Key Features",
        "content": "",
        "subsections": []
      },
      {
        "level": 3,
        "title": "**Error Handling**",
        "content": "- Comprehensive exception handling at each layer\n- Graceful degradation for network failures\n- Invalid data filtering and cleanup\n- Retry mechanisms with exponential backoff\n\nThese will become actual try-catch blocks and error recovery mechanisms.\n\nError handling must cover all failure scenarios, recovery mechanisms must be reliable.",
        "subsections": []
      },
      {
        "level": 3,
        "title": "**Data Validation**",
        "content": "- Multi-layer validation (parsing, loading, database)\n- Price relationship validation\n- Volume data normalization\n- Duplicate detection and handling\n\nThese will become actual validation functions and data transformation logic.\n\nValidation must be comprehensive, data transformation must be reliable.",
        "subsections": []
      },
      {
        "level": 3,
        "title": "**Performance Optimizations**",
        "content": "- Async/await throughout the stack\n- Batch database operations\n- Efficient file handling\n- Configurable timeouts and retries\n\nThese will become actual async implementations and performance optimizations.\n\nPerformance must meet specified requirements, optimizations must be measurable.",
        "subsections": []
      },
      {
        "level": 3,
        "title": "**Monitoring & Observability**",
        "content": "- Structured logging with different levels\n- Status tracking for tracked stocks\n- Error message persistence\n- Processing status updates\n\nThese will become actual logging implementations and monitoring code.\n\nLogging must be comprehensive, monitoring must be actionable.",
        "subsections": []
      },
      {
        "level": 2,
        "title": "Configuration Options",
        "content": "",
        "subsections": []
      },
      {
        "level": 3,
        "title": "**HTTP Settings**",
        "content": "- User agent customization\n- Request timeout (default: 30s)\n- Max retries (default: 3)\n- Retry delay (default: 5s)\n\nThese will become actual configuration field definitions with default values.",
        "subsections": []
      },
      {
        "level": 3,
        "title": "**File Management**",
        "content": "- Raw responses directory: `cream_api/files/raw_responses/`\n- Parsed responses directory: `cream_api/files/parsed_responses/`\n- Automatic directory creation\n\nThese will become actual directory management and file handling code.",
        "subsections": []
      },
      {
        "level": 2,
        "title": "Current Limitations",
        "content": "",
        "subsections": []
      },
      {
        "level": 3,
        "title": "**Data Source**",
        "content": "- Single source (Yahoo Finance)\n- No real-time data support\n- Limited to historical data\n\nThese limitations will inform future enhancement planning and implementation.",
        "subsections": []
      },
      {
        "level": 3,
        "title": "**Processing**",
        "content": "- Sequential file processing\n- No parallel processing of multiple symbols\n- Limited data transformation capabilities\n\nThese limitations will inform performance optimization and scalability improvements.",
        "subsections": []
      },
      {
        "level": 3,
        "title": "**Storage**",
        "content": "- No data compression\n- No data archival strategy\n- Limited query optimization\n\nThese limitations will inform storage optimization and data management improvements.",
        "subsections": []
      },
      {
        "level": 3,
        "title": "**API**",
        "content": "- Minimal endpoint coverage\n- No data retrieval endpoints\n- No analytics or aggregation\n\nThese limitations will inform API expansion and feature development.",
        "subsections": []
      },
      {
        "level": 2,
        "title": "Future Enhancement Opportunities",
        "content": "",
        "subsections": []
      },
      {
        "level": 3,
        "title": "**Immediate Improvements**",
        "content": "1. **Parallel Processing**: Implement concurrent symbol processing\n2. **Data Compression**: Add compression for stored HTML files\n3. **Caching Layer**: Implement Redis caching for frequently accessed data\n4. **API Expansion**: Add endpoints for data retrieval and analytics\n\nThese will become actual implementation tasks and code changes.",
        "subsections": []
      },
      {
        "level": 3,
        "title": "**Advanced Features**",
        "content": "1. **Multiple Data Sources**: Integrate with other financial data providers\n2. **Real-time Data**: WebSocket support for live price updates\n3. **Data Analytics**: Built-in technical indicators and analysis\n4. **Machine Learning**: Predictive modeling capabilities\n\nThese will become actual feature plans and implementation roadmaps.",
        "subsections": []
      },
      {
        "level": 3,
        "title": "**Infrastructure**",
        "content": "1. **Message Queues**: Implement Celery/RQ for task management\n2. **Data Warehousing**: Move to dedicated data warehouse\n3. **Monitoring**: Add metrics collection and alerting\n4. **Backup Strategy**: Implement data backup and recovery\n\nThese will become actual infrastructure improvements and deployment changes.",
        "subsections": []
      },
      {
        "level": 3,
        "title": "**User Experience**",
        "content": "1. **Web Interface**: Dashboard for stock tracking\n2. **Notifications**: Email/SMS alerts for price movements\n3. **Portfolio Management**: Multi-stock portfolio tracking\n4. **Export Capabilities**: CSV/Excel data export\n\nThese will become actual UI components and user experience improvements.",
        "subsections": []
      },
      {
        "level": 2,
        "title": "Dependencies",
        "content": "",
        "subsections": []
      },
      {
        "level": 3,
        "title": "**Core Dependencies**",
        "content": "- `fastapi`: API framework\n- `sqlalchemy`: Database ORM\n- `aiohttp`: Async HTTP client\n- `beautifulsoup4`: HTML parsing\n- `pandas`: Data manipulation\n- `pydantic`: Data validation\n\nThese will become actual requirements.txt entries and import statements.",
        "subsections": []
      },
      {
        "level": 3,
        "title": "**Development Dependencies**",
        "content": "- `pytest`: Testing framework\n- `stargazer_utils`: Logging utilities\n\nThese will become actual dev-requirements.txt entries and test imports.",
        "subsections": []
      },
      {
        "level": 2,
        "title": "Testing Strategy",
        "content": "",
        "subsections": []
      },
      {
        "level": 3,
        "title": "**Current Test Coverage**",
        "content": "- Unit tests for individual components\n- Integration tests for data pipeline\n- API endpoint testing\n- Error handling validation\n\nThese will become actual pytest test files and test functions.",
        "subsections": []
      },
      {
        "level": 3,
        "title": "**Test Structure**",
        "content": "- `tests/stock_data/test_retriever.py`: HTTP client testing\n- `tests/stock_data/test_parser.py`: HTML parsing validation\n- `tests/stock_data/test_loader.py`: Database operations\n- `tests/stock_data/test_api.py`: Endpoint functionality\n\nThese will become actual test file structures and test case implementations.",
        "subsections": []
      },
      {
        "level": 2,
        "title": "Integration Points",
        "content": "",
        "subsections": []
      },
      {
        "level": 3,
        "title": "**Database Integration**",
        "content": "- SQLAlchemy ORM for data persistence\n- Async database sessions\n- Migration support via Alembic\n\nThese will become actual database configuration and session management code.",
        "subsections": []
      },
      {
        "level": 3,
        "title": "**API Integration**",
        "content": "- FastAPI router integration\n- Background task coordination\n- Error handling and rollback\n\nThese will become actual API router registration and endpoint implementations.",
        "subsections": []
      },
      {
        "level": 3,
        "title": "**External Services**",
        "content": "- Yahoo Finance API for data retrieval\n- File system for temporary storage\n- Logging system for monitoring\n\nThese will become actual external service integrations and configuration.",
        "subsections": []
      },
      {
        "level": 2,
        "title": "Performance Characteristics",
        "content": "",
        "subsections": []
      },
      {
        "level": 3,
        "title": "**Current Performance**",
        "content": "- Sequential processing of stock symbols\n- File-based temporary storage\n- Database batch operations\n- Configurable timeouts and retries\n\nThese will become actual performance benchmarks and optimization targets.",
        "subsections": []
      },
      {
        "level": 3,
        "title": "**Bottlenecks**",
        "content": "- Single-threaded processing\n- File I/O operations\n- Database connection pooling\n- Network request latency\n\nThese will become actual performance optimization tasks and code improvements.",
        "subsections": []
      },
      {
        "level": 3,
        "title": "**Optimization Opportunities**",
        "content": "- Parallel symbol processing\n- In-memory caching\n- Database query optimization\n- Connection pooling improvements\n\nThese will become actual optimization implementations and performance improvements.",
        "subsections": []
      },
      {
        "level": 2,
        "title": "Maintenance Considerations",
        "content": "",
        "subsections": []
      },
      {
        "level": 3,
        "title": "**Technical Debt**",
        "content": "- Sequential processing limits scalability\n- File-based storage not optimal for large datasets\n- Limited error recovery mechanisms\n- No comprehensive monitoring\n\nThese will become actual refactoring tasks and technical debt reduction.",
        "subsections": []
      },
      {
        "level": 3,
        "title": "**Refactoring Opportunities**",
        "content": "- Implement parallel processing\n- Add caching layer\n- Improve error handling\n- Add comprehensive monitoring\n\nThese will become actual refactoring implementations and code improvements.",
        "subsections": []
      },
      {
        "level": 3,
        "title": "**Future Considerations**",
        "content": "- Scale to handle multiple data sources\n- Implement real-time data processing\n- Add advanced analytics capabilities\n- Improve user interface integration\n\nThese will become actual future development plans and implementation roadmaps.",
        "subsections": []
      },
      {
        "level": 2,
        "title": "Related Features",
        "content": "",
        "subsections": []
      },
      {
        "level": 3,
        "title": "**Current Integration**",
        "content": "- Stock tracking request UI (planned)\n- Background task management\n- User authentication system\n- Database migration system\n\nThese will become actual integration implementations and cross-module dependencies.",
        "subsections": []
      },
      {
        "level": 3,
        "title": "**Future Integration**",
        "content": "- Real-time data streaming\n- Advanced analytics dashboard\n- Portfolio management system\n- Notification system\n\nThese will become actual integration planning and implementation tasks.",
        "subsections": []
      },
      {
        "level": 2,
        "title": "Documentation References",
        "content": "- **API Documentation**: OpenAPI/Swagger specs\n- **Database Schema**: Alembic migration files\n- **Configuration**: Environment variables and config files\n- **Testing**: Comprehensive test suite with fixtures\n\nThese will become actual documentation generation and maintenance tasks.",
        "subsections": []
      },
      {
        "level": 2,
        "title": "Implementation Notes",
        "content": "",
        "subsections": []
      },
      {
        "level": 3,
        "title": "**Current Architecture Strengths**",
        "content": "- Modular design with clear separation of concerns\n- Comprehensive error handling and validation\n- Async/await throughout for performance\n- Configurable and extensible design\n\nThese strengths will inform future development and maintain architectural consistency.",
        "subsections": []
      },
      {
        "level": 3,
        "title": "**Integration with Stock Tracking Request UI**",
        "content": "- Existing `TrackedStock` model provides foundation for user requests\n- Current API endpoints can be extended for user-driven tracking\n- Background task system supports new tracking requests\n- Database schema supports the planned feature requirements\n\nThis integration will inform the Stock Tracking Request UI implementation and API extensions.",
        "subsections": []
      },
      {
        "level": 3,
        "title": "**Migration Path for Enhancements**",
        "content": "- Parallel processing can be added incrementally\n- Caching layer can be implemented without breaking changes\n- API expansion can follow existing patterns\n- Real-time features can be added as separate modules\n\nThis migration path will inform enhancement planning and implementation strategy.",
        "subsections": []
      },
      {
        "level": 2,
        "title": "Quality Assurance",
        "content": "",
        "subsections": []
      },
      {
        "level": 3,
        "title": "**Code Quality Standards**",
        "content": "- Comprehensive test coverage (90%+ target)\n- Type hints throughout the codebase\n- Comprehensive error handling\n- Performance benchmarks and monitoring\n\nThese standards will inform code review and quality assurance processes.",
        "subsections": []
      },
      {
        "level": 3,
        "title": "**Documentation Requirements**",
        "content": "- API documentation with examples\n- Code comments for complex logic\n- Architecture diagrams and flow charts\n- Performance characteristics and limitations\n\nThese requirements will inform documentation generation and maintenance.",
        "subsections": []
      },
      {
        "level": 3,
        "title": "**Monitoring and Alerting**",
        "content": "- Performance metrics collection\n- Error rate monitoring\n- Data quality validation\n- System health checks\n\nThese will become actual monitoring implementations and alerting systems.\n\n---\n\n**AI Quality Checklist**: Before completing this summary, ensure:\n- [x] All file paths reference actual codebase structure\n- [x] Implementation details are specific and actionable\n- [x] Performance characteristics are measurable\n- [x] Integration points reference existing systems\n- [x] Code generation hints are actionable\n- [x] Validation rules are satisfied\n- [x] Dependencies are properly referenced\n- [x] Future enhancements are well-defined\n- [x] Quality standards are comprehensive",
        "subsections": []
      }
    ],
    "code_blocks": [
      {
        "language": "text",
        "code": "User Request → API Endpoint → Database Check → Create TrackedStock → Background Task"
      },
      {
        "language": "text",
        "code": "Symbol → HTTP Request → Yahoo Finance → HTML Response → File Save → Processing"
      },
      {
        "language": "text",
        "code": "Raw HTML File → Parser → Validated Data → Loader → Database Storage → File Cleanup"
      }
    ],
    "links": [
      {
        "type": "code_reference",
        "text": "../project_context/Architecture%20Overview.md"
      },
      {
        "type": "code_reference",
        "text": "../project_context/Common%20Patterns.md"
      },
      {
        "type": "code_reference",
        "text": "../project_context/Development%20Workflow.md"
      },
      {
        "type": "code_reference",
        "text": "../guide_docs/Core%20Principles.md"
      },
      {
        "type": "code_reference",
        "text": "../plans/[IN-PROGRESS]-Stock%20Tracking%20Request%20Plan.md"
      },
      {
        "type": "code_reference",
        "text": "cream_api/stock_data/config.py"
      },
      {
        "type": "code_reference",
        "text": "cream_api/stock_data/models.py"
      },
      {
        "type": "code_reference",
        "text": "cream_api/stock_data/retriever.py"
      },
      {
        "type": "code_reference",
        "text": "cream_api/stock_data/parser.py"
      },
      {
        "type": "code_reference",
        "text": "cream_api/stock_data/loader.py"
      },
      {
        "type": "code_reference",
        "text": "cream_api/stock_data/processor.py"
      },
      {
        "type": "code_reference",
        "text": "cream_api/stock_data/tasks.py"
      },
      {
        "type": "code_reference",
        "text": "cream_api/stock_data/api.py"
      },
      {
        "type": "code_reference",
        "text": "\n\nThis workflow will inform the API endpoint implementation and background task integration.\n\n### 2. **Data Retrieval Workflow**\n"
      },
      {
        "type": "code_reference",
        "text": "\n\nThis workflow will inform the HTTP client implementation and file management logic.\n\n### 3. **Data Processing Workflow**\n"
      },
      {
        "type": "code_reference",
        "text": "\n\nThis workflow will inform the pipeline orchestration and data transformation logic.\n\n## Key Features\n\n### **Error Handling**\n- Comprehensive exception handling at each layer\n- Graceful degradation for network failures\n- Invalid data filtering and cleanup\n- Retry mechanisms with exponential backoff\n\nThese will become actual try-catch blocks and error recovery mechanisms.\n\nError handling must cover all failure scenarios, recovery mechanisms must be reliable.\n\n### **Data Validation**\n- Multi-layer validation (parsing, loading, database)\n- Price relationship validation\n- Volume data normalization\n- Duplicate detection and handling\n\nThese will become actual validation functions and data transformation logic.\n\nValidation must be comprehensive, data transformation must be reliable.\n\n### **Performance Optimizations**\n- Async/await throughout the stack\n- Batch database operations\n- Efficient file handling\n- Configurable timeouts and retries\n\nThese will become actual async implementations and performance optimizations.\n\nPerformance must meet specified requirements, optimizations must be measurable.\n\n### **Monitoring & Observability**\n- Structured logging with different levels\n- Status tracking for tracked stocks\n- Error message persistence\n- Processing status updates\n\nThese will become actual logging implementations and monitoring code.\n\nLogging must be comprehensive, monitoring must be actionable.\n\n## Configuration Options\n\n### **HTTP Settings**\n- User agent customization\n- Request timeout (default: 30s)\n- Max retries (default: 3)\n- Retry delay (default: 5s)\n\nThese will become actual configuration field definitions with default values.\n\n### **File Management**\n- Raw responses directory: "
      },
      {
        "type": "code_reference",
        "text": "\n- Automatic directory creation\n\nThese will become actual directory management and file handling code.\n\n## Current Limitations\n\n### **Data Source**\n- Single source (Yahoo Finance)\n- No real-time data support\n- Limited to historical data\n\nThese limitations will inform future enhancement planning and implementation.\n\n### **Processing**\n- Sequential file processing\n- No parallel processing of multiple symbols\n- Limited data transformation capabilities\n\nThese limitations will inform performance optimization and scalability improvements.\n\n### **Storage**\n- No data compression\n- No data archival strategy\n- Limited query optimization\n\nThese limitations will inform storage optimization and data management improvements.\n\n### **API**\n- Minimal endpoint coverage\n- No data retrieval endpoints\n- No analytics or aggregation\n\nThese limitations will inform API expansion and feature development.\n\n## Future Enhancement Opportunities\n\n### **Immediate Improvements**\n1. **Parallel Processing**: Implement concurrent symbol processing\n2. **Data Compression**: Add compression for stored HTML files\n3. **Caching Layer**: Implement Redis caching for frequently accessed data\n4. **API Expansion**: Add endpoints for data retrieval and analytics\n\nThese will become actual implementation tasks and code changes.\n\n### **Advanced Features**\n1. **Multiple Data Sources**: Integrate with other financial data providers\n2. **Real-time Data**: WebSocket support for live price updates\n3. **Data Analytics**: Built-in technical indicators and analysis\n4. **Machine Learning**: Predictive modeling capabilities\n\nThese will become actual feature plans and implementation roadmaps.\n\n### **Infrastructure**\n1. **Message Queues**: Implement Celery/RQ for task management\n2. **Data Warehousing**: Move to dedicated data warehouse\n3. **Monitoring**: Add metrics collection and alerting\n4. **Backup Strategy**: Implement data backup and recovery\n\nThese will become actual infrastructure improvements and deployment changes.\n\n### **User Experience**\n1. **Web Interface**: Dashboard for stock tracking\n2. **Notifications**: Email/SMS alerts for price movements\n3. **Portfolio Management**: Multi-stock portfolio tracking\n4. **Export Capabilities**: CSV/Excel data export\n\nThese will become actual UI components and user experience improvements.\n\n## Dependencies\n\n### **Core Dependencies**\n- "
      },
      {
        "type": "code_reference",
        "text": ": Data validation\n\nThese will become actual requirements.txt entries and import statements.\n\n### **Development Dependencies**\n- "
      },
      {
        "type": "code_reference",
        "text": ": Logging utilities\n\nThese will become actual dev-requirements.txt entries and test imports.\n\n## Testing Strategy\n\n### **Current Test Coverage**\n- Unit tests for individual components\n- Integration tests for data pipeline\n- API endpoint testing\n- Error handling validation\n\nThese will become actual pytest test files and test functions.\n\n### **Test Structure**\n- "
      },
      {
        "type": "code_reference",
        "text": ": Endpoint functionality\n\nThese will become actual test file structures and test case implementations.\n\n## Integration Points\n\n### **Database Integration**\n- SQLAlchemy ORM for data persistence\n- Async database sessions\n- Migration support via Alembic\n\nThese will become actual database configuration and session management code.\n\n### **API Integration**\n- FastAPI router integration\n- Background task coordination\n- Error handling and rollback\n\nThese will become actual API router registration and endpoint implementations.\n\n### **External Services**\n- Yahoo Finance API for data retrieval\n- File system for temporary storage\n- Logging system for monitoring\n\nThese will become actual external service integrations and configuration.\n\n## Performance Characteristics\n\n### **Current Performance**\n- Sequential processing of stock symbols\n- File-based temporary storage\n- Database batch operations\n- Configurable timeouts and retries\n\nThese will become actual performance benchmarks and optimization targets.\n\n### **Bottlenecks**\n- Single-threaded processing\n- File I/O operations\n- Database connection pooling\n- Network request latency\n\nThese will become actual performance optimization tasks and code improvements.\n\n### **Optimization Opportunities**\n- Parallel symbol processing\n- In-memory caching\n- Database query optimization\n- Connection pooling improvements\n\nThese will become actual optimization implementations and performance improvements.\n\n## Maintenance Considerations\n\n### **Technical Debt**\n- Sequential processing limits scalability\n- File-based storage not optimal for large datasets\n- Limited error recovery mechanisms\n- No comprehensive monitoring\n\nThese will become actual refactoring tasks and technical debt reduction.\n\n### **Refactoring Opportunities**\n- Implement parallel processing\n- Add caching layer\n- Improve error handling\n- Add comprehensive monitoring\n\nThese will become actual refactoring implementations and code improvements.\n\n### **Future Considerations**\n- Scale to handle multiple data sources\n- Implement real-time data processing\n- Add advanced analytics capabilities\n- Improve user interface integration\n\nThese will become actual future development plans and implementation roadmaps.\n\n## Related Features\n\n### **Current Integration**\n- Stock tracking request UI (planned)\n- Background task management\n- User authentication system\n- Database migration system\n\nThese will become actual integration implementations and cross-module dependencies.\n\n### **Future Integration**\n- Real-time data streaming\n- Advanced analytics dashboard\n- Portfolio management system\n- Notification system\n\nThese will become actual integration planning and implementation tasks.\n\n## Documentation References\n\n- **API Documentation**: OpenAPI/Swagger specs\n- **Database Schema**: Alembic migration files\n- **Configuration**: Environment variables and config files\n- **Testing**: Comprehensive test suite with fixtures\n\nThese will become actual documentation generation and maintenance tasks.\n\n## Implementation Notes\n\n### **Current Architecture Strengths**\n- Modular design with clear separation of concerns\n- Comprehensive error handling and validation\n- Async/await throughout for performance\n- Configurable and extensible design\n\nThese strengths will inform future development and maintain architectural consistency.\n\n### **Integration with Stock Tracking Request UI**\n- Existing "
      }
    ],
    "raw_content": "# Stock Data Processing Pipeline Summary\n\n> This document summarizes the completed stock data processing pipeline implementation. Use this for understanding the implemented solution and its components.\n\n## AI Metadata\n\n**Template Version:** 2.1\n**AI Processing Level:** High\n**Required Context:** Project architecture, existing patterns, implementation details\n**Validation Required:** Yes\n**Code Generation:** Supported\n\n**Dependencies:**\n- `../project_context/Architecture%20Overview.md` - System architecture\n- `../project_context/Common%20Patterns.md` - Project patterns\n- `../project_context/Development%20Workflow.md` - Development process\n- `../guide_docs/Core%20Principles.md` - Decision frameworks\n- `../plans/[IN-PROGRESS]-Stock%20Tracking%20Request%20Plan.md` - Related feature plan\n\n**Validation Rules:**\n- All file paths must reference actual codebase structure\n- Implementation details must be specific and actionable\n- Performance characteristics must be measurable\n- Integration points must reference existing systems\n- Code generation hints must be actionable\n\n## Overview\n\n**Module Name:** Stock Data Processing Pipeline\n**Status:** Completed Implementation\n**Last Updated:** Current\n**Related Features:** Stock Tracking Request UI (planned)\n\n**AI Context:** This module serves as the foundation for stock data processing and will be extended by the Stock Tracking Request UI feature. The existing architecture provides a solid base for user-driven stock tracking requests while maintaining the current automated processing capabilities.\n\n## Architecture\n\n### Core Components\n\n#### 1. **Configuration (`cream_api/stock_data/config.py`)**\n- **Purpose**: Centralized configuration management for the entire module\n- **Key Features**:\n  - Pydantic-based configuration with validation\n  - Automatic directory creation for raw and parsed responses\n  - Configurable HTTP request parameters (timeout, retries, user agent)\n  - Default configuration with override capabilities\n\nThis will become the actual Pydantic configuration class with field definitions and validation.\n\nConfiguration fields must match existing patterns, validation rules must be comprehensive.\n\n#### 2. **Data Models (`cream_api/stock_data/models.py`)**\n- **StockData**: Core model for historical price data\n  - Fields: `id: int, symbol: str, date: date, open: float, high: float, low: float, close: float, adj_close: float, volume: int`\n  - Unique constraint on `(symbol, date)` combination\n  - Indexed fields for efficient querying\n- **TrackedStock**: Model for managing stock tracking status\n  - Fields: `id: int, symbol: str, last_pull_date: datetime, last_pull_status: str, error_message: str, is_active: bool`\n  - Tracks last pull date, status, error messages\n  - Supports active/inactive tracking states\n  - Unique constraint on symbol\n\nThese will become the actual SQLAlchemy model definitions with proper relationships and constraints.\n\nField types must match existing patterns, relationships must be valid, constraints must be properly defined.\n\n#### 3. **Data Retrieval (`cream_api/stock_data/retriever.py`)**\n- **StockDataRetriever**: Asynchronous HTTP client for Yahoo Finance\n- **Key Features**:\n  - Robust retry logic with exponential backoff\n  - Rate limiting handling (429 responses)\n  - Comprehensive error handling for network issues\n  - Automatic HTML content saving to files\n  - Configurable user agent and headers\n\nThis will become the actual aiohttp client implementation with retry logic and error handling.\n\nHTTP client must handle all error scenarios, retry logic must be configurable, file saving must be reliable.\n\n#### 4. **Data Parsing (`cream_api/stock_data/parser.py`)**\n- **StockDataParser**: HTML parsing and data extraction\n- **Key Features**:\n  - BeautifulSoup-based HTML parsing\n  - Dividend and stock split row filtering\n  - Data validation and cleaning\n  - Column mapping and normalization\n  - Price relationship validation (high >= low, etc.)\n\nThis will become the actual BeautifulSoup parsing implementation with data validation logic.\n\nParsing must handle all HTML variations, data validation must be comprehensive, error handling must be robust.\n\n#### 5. **Data Loading (`cream_api/stock_data/loader.py`)**\n- **StockDataLoader**: Database operations and data transformation\n- **Key Features**:\n  - Async database session management\n  - Data validation before storage\n  - Volume data cleaning and normalization\n  - Batch processing capabilities\n  - Error handling for invalid data\n\nThis will become the actual SQLAlchemy async session management with data transformation logic.\n\nDatabase operations must be efficient, data validation must prevent invalid data, error handling must be comprehensive.\n\n#### 6. **File Processing (`cream_api/stock_data/processor.py`)**\n- **FileProcessor**: Orchestrates the complete data pipeline\n- **Key Features**:\n  - Coordinates parsing and loading operations\n  - File movement between raw and parsed directories\n  - Invalid file handling and cleanup\n  - Error recovery mechanisms\n\nThis will become the actual pipeline orchestration code with file management and error recovery.\n\nPipeline must be reliable, file management must be atomic, error recovery must be comprehensive.\n\n#### 7. **Background Tasks (`cream_api/stock_data/tasks.py`)**\n- **Async task management for automated operations**\n- **Key Features**:\n  - Periodic stock data updates\n  - Batch processing of tracked stocks\n  - Status tracking and error reporting\n  - Configurable update intervals\n\nThis will become the actual Celery task definitions with scheduling and error handling.\n\nTasks must be reliable, scheduling must be configurable, error reporting must be comprehensive.\n\n#### 8. **API Endpoints (`cream_api/stock_data/api.py`)**\n- **FastAPI router for stock data operations**\n- **Current Endpoints**:\n  - `POST /stock-data/track`: Add new stock to tracking\n- **Features**:\n  - Background task integration\n  - Database session management\n  - Error handling and rollback\n\nThis will become the actual FastAPI endpoint definitions with proper request/response models.\n\nEndpoints must be secure, error handling must be comprehensive, response models must be properly defined.\n\n## Data Flow\n\n### 1. **Stock Tracking Workflow**\n```\nUser Request → API Endpoint → Database Check → Create TrackedStock → Background Task\n```\n\nThis workflow will inform the API endpoint implementation and background task integration.\n\n### 2. **Data Retrieval Workflow**\n```\nSymbol → HTTP Request → Yahoo Finance → HTML Response → File Save → Processing\n```\n\nThis workflow will inform the HTTP client implementation and file management logic.\n\n### 3. **Data Processing Workflow**\n```\nRaw HTML File → Parser → Validated Data → Loader → Database Storage → File Cleanup\n```\n\nThis workflow will inform the pipeline orchestration and data transformation logic.\n\n## Key Features\n\n### **Error Handling**\n- Comprehensive exception handling at each layer\n- Graceful degradation for network failures\n- Invalid data filtering and cleanup\n- Retry mechanisms with exponential backoff\n\nThese will become actual try-catch blocks and error recovery mechanisms.\n\nError handling must cover all failure scenarios, recovery mechanisms must be reliable.\n\n### **Data Validation**\n- Multi-layer validation (parsing, loading, database)\n- Price relationship validation\n- Volume data normalization\n- Duplicate detection and handling\n\nThese will become actual validation functions and data transformation logic.\n\nValidation must be comprehensive, data transformation must be reliable.\n\n### **Performance Optimizations**\n- Async/await throughout the stack\n- Batch database operations\n- Efficient file handling\n- Configurable timeouts and retries\n\nThese will become actual async implementations and performance optimizations.\n\nPerformance must meet specified requirements, optimizations must be measurable.\n\n### **Monitoring & Observability**\n- Structured logging with different levels\n- Status tracking for tracked stocks\n- Error message persistence\n- Processing status updates\n\nThese will become actual logging implementations and monitoring code.\n\nLogging must be comprehensive, monitoring must be actionable.\n\n## Configuration Options\n\n### **HTTP Settings**\n- User agent customization\n- Request timeout (default: 30s)\n- Max retries (default: 3)\n- Retry delay (default: 5s)\n\nThese will become actual configuration field definitions with default values.\n\n### **File Management**\n- Raw responses directory: `cream_api/files/raw_responses/`\n- Parsed responses directory: `cream_api/files/parsed_responses/`\n- Automatic directory creation\n\nThese will become actual directory management and file handling code.\n\n## Current Limitations\n\n### **Data Source**\n- Single source (Yahoo Finance)\n- No real-time data support\n- Limited to historical data\n\nThese limitations will inform future enhancement planning and implementation.\n\n### **Processing**\n- Sequential file processing\n- No parallel processing of multiple symbols\n- Limited data transformation capabilities\n\nThese limitations will inform performance optimization and scalability improvements.\n\n### **Storage**\n- No data compression\n- No data archival strategy\n- Limited query optimization\n\nThese limitations will inform storage optimization and data management improvements.\n\n### **API**\n- Minimal endpoint coverage\n- No data retrieval endpoints\n- No analytics or aggregation\n\nThese limitations will inform API expansion and feature development.\n\n## Future Enhancement Opportunities\n\n### **Immediate Improvements**\n1. **Parallel Processing**: Implement concurrent symbol processing\n2. **Data Compression**: Add compression for stored HTML files\n3. **Caching Layer**: Implement Redis caching for frequently accessed data\n4. **API Expansion**: Add endpoints for data retrieval and analytics\n\nThese will become actual implementation tasks and code changes.\n\n### **Advanced Features**\n1. **Multiple Data Sources**: Integrate with other financial data providers\n2. **Real-time Data**: WebSocket support for live price updates\n3. **Data Analytics**: Built-in technical indicators and analysis\n4. **Machine Learning**: Predictive modeling capabilities\n\nThese will become actual feature plans and implementation roadmaps.\n\n### **Infrastructure**\n1. **Message Queues**: Implement Celery/RQ for task management\n2. **Data Warehousing**: Move to dedicated data warehouse\n3. **Monitoring**: Add metrics collection and alerting\n4. **Backup Strategy**: Implement data backup and recovery\n\nThese will become actual infrastructure improvements and deployment changes.\n\n### **User Experience**\n1. **Web Interface**: Dashboard for stock tracking\n2. **Notifications**: Email/SMS alerts for price movements\n3. **Portfolio Management**: Multi-stock portfolio tracking\n4. **Export Capabilities**: CSV/Excel data export\n\nThese will become actual UI components and user experience improvements.\n\n## Dependencies\n\n### **Core Dependencies**\n- `fastapi`: API framework\n- `sqlalchemy`: Database ORM\n- `aiohttp`: Async HTTP client\n- `beautifulsoup4`: HTML parsing\n- `pandas`: Data manipulation\n- `pydantic`: Data validation\n\nThese will become actual requirements.txt entries and import statements.\n\n### **Development Dependencies**\n- `pytest`: Testing framework\n- `stargazer_utils`: Logging utilities\n\nThese will become actual dev-requirements.txt entries and test imports.\n\n## Testing Strategy\n\n### **Current Test Coverage**\n- Unit tests for individual components\n- Integration tests for data pipeline\n- API endpoint testing\n- Error handling validation\n\nThese will become actual pytest test files and test functions.\n\n### **Test Structure**\n- `tests/stock_data/test_retriever.py`: HTTP client testing\n- `tests/stock_data/test_parser.py`: HTML parsing validation\n- `tests/stock_data/test_loader.py`: Database operations\n- `tests/stock_data/test_api.py`: Endpoint functionality\n\nThese will become actual test file structures and test case implementations.\n\n## Integration Points\n\n### **Database Integration**\n- SQLAlchemy ORM for data persistence\n- Async database sessions\n- Migration support via Alembic\n\nThese will become actual database configuration and session management code.\n\n### **API Integration**\n- FastAPI router integration\n- Background task coordination\n- Error handling and rollback\n\nThese will become actual API router registration and endpoint implementations.\n\n### **External Services**\n- Yahoo Finance API for data retrieval\n- File system for temporary storage\n- Logging system for monitoring\n\nThese will become actual external service integrations and configuration.\n\n## Performance Characteristics\n\n### **Current Performance**\n- Sequential processing of stock symbols\n- File-based temporary storage\n- Database batch operations\n- Configurable timeouts and retries\n\nThese will become actual performance benchmarks and optimization targets.\n\n### **Bottlenecks**\n- Single-threaded processing\n- File I/O operations\n- Database connection pooling\n- Network request latency\n\nThese will become actual performance optimization tasks and code improvements.\n\n### **Optimization Opportunities**\n- Parallel symbol processing\n- In-memory caching\n- Database query optimization\n- Connection pooling improvements\n\nThese will become actual optimization implementations and performance improvements.\n\n## Maintenance Considerations\n\n### **Technical Debt**\n- Sequential processing limits scalability\n- File-based storage not optimal for large datasets\n- Limited error recovery mechanisms\n- No comprehensive monitoring\n\nThese will become actual refactoring tasks and technical debt reduction.\n\n### **Refactoring Opportunities**\n- Implement parallel processing\n- Add caching layer\n- Improve error handling\n- Add comprehensive monitoring\n\nThese will become actual refactoring implementations and code improvements.\n\n### **Future Considerations**\n- Scale to handle multiple data sources\n- Implement real-time data processing\n- Add advanced analytics capabilities\n- Improve user interface integration\n\nThese will become actual future development plans and implementation roadmaps.\n\n## Related Features\n\n### **Current Integration**\n- Stock tracking request UI (planned)\n- Background task management\n- User authentication system\n- Database migration system\n\nThese will become actual integration implementations and cross-module dependencies.\n\n### **Future Integration**\n- Real-time data streaming\n- Advanced analytics dashboard\n- Portfolio management system\n- Notification system\n\nThese will become actual integration planning and implementation tasks.\n\n## Documentation References\n\n- **API Documentation**: OpenAPI/Swagger specs\n- **Database Schema**: Alembic migration files\n- **Configuration**: Environment variables and config files\n- **Testing**: Comprehensive test suite with fixtures\n\nThese will become actual documentation generation and maintenance tasks.\n\n## Implementation Notes\n\n### **Current Architecture Strengths**\n- Modular design with clear separation of concerns\n- Comprehensive error handling and validation\n- Async/await throughout for performance\n- Configurable and extensible design\n\nThese strengths will inform future development and maintain architectural consistency.\n\n### **Integration with Stock Tracking Request UI**\n- Existing `TrackedStock` model provides foundation for user requests\n- Current API endpoints can be extended for user-driven tracking\n- Background task system supports new tracking requests\n- Database schema supports the planned feature requirements\n\nThis integration will inform the Stock Tracking Request UI implementation and API extensions.\n\n### **Migration Path for Enhancements**\n- Parallel processing can be added incrementally\n- Caching layer can be implemented without breaking changes\n- API expansion can follow existing patterns\n- Real-time features can be added as separate modules\n\nThis migration path will inform enhancement planning and implementation strategy.\n\n## Quality Assurance\n\n### **Code Quality Standards**\n- Comprehensive test coverage (90%+ target)\n- Type hints throughout the codebase\n- Comprehensive error handling\n- Performance benchmarks and monitoring\n\nThese standards will inform code review and quality assurance processes.\n\n### **Documentation Requirements**\n- API documentation with examples\n- Code comments for complex logic\n- Architecture diagrams and flow charts\n- Performance characteristics and limitations\n\nThese requirements will inform documentation generation and maintenance.\n\n### **Monitoring and Alerting**\n- Performance metrics collection\n- Error rate monitoring\n- Data quality validation\n- System health checks\n\nThese will become actual monitoring implementations and alerting systems.\n\n---\n\n**AI Quality Checklist**: Before completing this summary, ensure:\n- [x] All file paths reference actual codebase structure\n- [x] Implementation details are specific and actionable\n- [x] Performance characteristics are measurable\n- [x] Integration points reference existing systems\n- [x] Code generation hints are actionable\n- [x] Validation rules are satisfied\n- [x] Dependencies are properly referenced\n- [x] Future enhancements are well-defined\n- [x] Quality standards are comprehensive\n"
  },
  "cross_references": [],
  "code_generation_hints": [
    {
      "context": "general",
      "hint": "This will become the actual Pydantic configuration class with field definitions and validation.",
      "validation": ""
    },
    {
      "context": "general",
      "hint": "These will become the actual SQLAlchemy model definitions with proper relationships and constraints.",
      "validation": ""
    },
    {
      "context": "error handling",
      "hint": "This will become the actual aiohttp client implementation with retry logic and error handling.",
      "validation": ""
    },
    {
      "context": "general",
      "hint": "This will become the actual BeautifulSoup parsing implementation with data validation logic.",
      "validation": ""
    },
    {
      "context": "general",
      "hint": "This will become the actual SQLAlchemy async session management with data transformation logic.",
      "validation": ""
    },
    {
      "context": "error handling",
      "hint": "This will become the actual pipeline orchestration code with file management and error recovery.",
      "validation": ""
    },
    {
      "context": "error handling",
      "hint": "This will become the actual Celery task definitions with scheduling and error handling.",
      "validation": ""
    },
    {
      "context": "general",
      "hint": "This will become the actual FastAPI endpoint definitions with proper request/response models.",
      "validation": ""
    },
    {
      "context": "general",
      "hint": "This workflow will inform the API endpoint implementation and background task integration.",
      "validation": ""
    },
    {
      "context": "general",
      "hint": "This workflow will inform the HTTP client implementation and file management logic.",
      "validation": ""
    },
    {
      "context": "general",
      "hint": "This workflow will inform the pipeline orchestration and data transformation logic.",
      "validation": ""
    },
    {
      "context": "error handling",
      "hint": "These will become actual try-catch blocks and error recovery mechanisms.",
      "validation": ""
    },
    {
      "context": "general",
      "hint": "These will become actual validation functions and data transformation logic.",
      "validation": ""
    },
    {
      "context": "general",
      "hint": "These will become actual async implementations and performance optimizations.",
      "validation": ""
    },
    {
      "context": "general",
      "hint": "These will become actual logging implementations and monitoring code.",
      "validation": ""
    },
    {
      "context": "general",
      "hint": "These will become actual configuration field definitions with default values.",
      "validation": ""
    },
    {
      "context": "general",
      "hint": "These will become actual directory management and file handling code.",
      "validation": ""
    },
    {
      "context": "general",
      "hint": "These limitations will inform future enhancement planning and implementation.",
      "validation": ""
    },
    {
      "context": "general",
      "hint": "These limitations will inform performance optimization and scalability improvements.",
      "validation": ""
    },
    {
      "context": "general",
      "hint": "These limitations will inform storage optimization and data management improvements.",
      "validation": ""
    },
    {
      "context": "general",
      "hint": "These limitations will inform API expansion and feature development.",
      "validation": ""
    },
    {
      "context": "general",
      "hint": "These will become actual implementation tasks and code changes.",
      "validation": ""
    },
    {
      "context": "general",
      "hint": "These will become actual feature plans and implementation roadmaps.",
      "validation": ""
    },
    {
      "context": "general",
      "hint": "These will become actual infrastructure improvements and deployment changes.",
      "validation": ""
    },
    {
      "context": "general",
      "hint": "These will become actual UI components and user experience improvements.",
      "validation": ""
    },
    {
      "context": "import organization",
      "hint": "These will become actual requirements.txt entries and import statements.",
      "validation": ""
    },
    {
      "context": "import organization",
      "hint": "These will become actual dev-requirements.txt entries and test imports.",
      "validation": ""
    },
    {
      "context": "testing",
      "hint": "These will become actual pytest test files and test functions.",
      "validation": ""
    },
    {
      "context": "testing",
      "hint": "These will become actual test file structures and test case implementations.",
      "validation": ""
    },
    {
      "context": "general",
      "hint": "These will become actual database configuration and session management code.",
      "validation": ""
    },
    {
      "context": "general",
      "hint": "These will become actual API router registration and endpoint implementations.",
      "validation": ""
    },
    {
      "context": "general",
      "hint": "These will become actual external service integrations and configuration.",
      "validation": ""
    },
    {
      "context": "general",
      "hint": "These will become actual performance benchmarks and optimization targets.",
      "validation": ""
    },
    {
      "context": "general",
      "hint": "These will become actual performance optimization tasks and code improvements.",
      "validation": ""
    },
    {
      "context": "general",
      "hint": "These will become actual optimization implementations and performance improvements.",
      "validation": ""
    },
    {
      "context": "general",
      "hint": "These will become actual refactoring tasks and technical debt reduction.",
      "validation": ""
    },
    {
      "context": "general",
      "hint": "These will become actual refactoring implementations and code improvements.",
      "validation": ""
    },
    {
      "context": "general",
      "hint": "These will become actual future development plans and implementation roadmaps.",
      "validation": ""
    },
    {
      "context": "general",
      "hint": "These will become actual integration implementations and cross-module dependencies.",
      "validation": ""
    },
    {
      "context": "general",
      "hint": "These will become actual integration planning and implementation tasks.",
      "validation": ""
    },
    {
      "context": "general",
      "hint": "These will become actual documentation generation and maintenance tasks.",
      "validation": ""
    },
    {
      "context": "general",
      "hint": "These strengths will inform future development and maintain architectural consistency.",
      "validation": ""
    },
    {
      "context": "general",
      "hint": "This integration will inform the Stock Tracking Request UI implementation and API extensions.",
      "validation": ""
    },
    {
      "context": "general",
      "hint": "This migration path will inform enhancement planning and implementation strategy.",
      "validation": ""
    },
    {
      "context": "general",
      "hint": "These standards will inform code review and quality assurance processes.",
      "validation": ""
    },
    {
      "context": "general",
      "hint": "These requirements will inform documentation generation and maintenance.",
      "validation": ""
    },
    {
      "context": "general",
      "hint": "These will become actual monitoring implementations and alerting systems.",
      "validation": ""
    }
  ],
  "validation_rules": [
    "Code generation hints must be actionable",
    "Error handling must cover all failure scenarios, recovery mechanisms must be reliable",
    "Implementation details must be specific and actionable",
    "Integration points must reference existing systems",
    "Logging must be comprehensive, monitoring must be actionable",
    "Database operations must be efficient, data validation must prevent invalid data, error handling must be comprehensive",
    "Pipeline must be reliable, file management must be atomic, error recovery must be comprehensive",
    "Tasks must be reliable, scheduling must be configurable, error reporting must be comprehensive",
    "All file paths must reference actual codebase structure",
    "Performance must meet specified requirements, optimizations must be measurable",
    "Validation must be comprehensive, data transformation must be reliable",
    "HTTP client must handle all error scenarios, retry logic must be configurable, file saving must be reliable",
    "Performance characteristics must be measurable",
    "Field types must match existing patterns, relationships must be valid, constraints must be properly defined",
    "Configuration fields must match existing patterns, validation rules must be comprehensive",
    "Parsing must handle all HTML variations, data validation must be comprehensive, error handling must be robust",
    "Endpoints must be secure, error handling must be comprehensive, response models must be properly defined"
  ],
  "optimization": {
    "version": "1.0",
    "optimized_at": "2025-06-18T19:19:47.731127",
    "improvements": [
      "fixed_file_references",
      "extracted_ai_metadata",
      "structured_cross_references",
      "extracted_code_hints",
      "structured_validation_rules"
    ],
    "literal_strings_cleaned": true,
    "cleaned_at": "2025-06-18T19:30:00.000000"
  }
}